"Authors","Author full names","Author(s) ID","Title","Year","Source title","Volume","Issue","Art. No.","Page start","Page end","Page count","Cited by","DOI","Link","Document Type","Publication Stage","Open Access","Source","EID"
"Wang N.; Liao Q.; Chang H.; Zhang D.","Wang, Nanzhe (57215084336); Liao, Qinzhuo (56079492000); Chang, Haibin (35203016100); Zhang, Dongxiao (57034330100)","57215084336; 56079492000; 35203016100; 57034330100","Deep-learning-based upscaling method for geologic models via theory-guided convolutional neural network","2023","Computational Geosciences","","","","","","","0","10.1007/s10596-023-10233-2","https://www.scopus.com/inward/record.uri?eid=2-s2.0-85166408977&doi=10.1007%2fs10596-023-10233-2&partnerID=40&md5=089439c4fde0b4f02585a064557315bf","Article","Article in press","All Open Access; Green Open Access; Hybrid Gold Open Access","Scopus","2-s2.0-85166408977"
"Sharma A.; Shrivastava B.P.","Sharma, Ajay (57752264200); Shrivastava, Bhavana P. (57202434941)","57752264200; 57202434941","Different Techniques of Image SR Using Deep Learning: A Review","2023","IEEE Sensors Journal","23","3","","1724","1733","9","1","10.1109/JSEN.2022.3229046","https://www.scopus.com/inward/record.uri?eid=2-s2.0-85146253092&doi=10.1109%2fJSEN.2022.3229046&partnerID=40&md5=7cb1faa83f6dd36b89c3ec72db14667e","Article","Final","","Scopus","2-s2.0-85146253092"
"","","","Society of Petroleum Engineers - SPE EuropEC - Europe Energy Conference featured at the 84th EAGE Annual Conference and Exhibition, EURO 2023","2023","Society of Petroleum Engineers - SPE EuropEC - Europe Energy Conference featured at the 84th EAGE Annual Conference and Exhibition, EURO 2023","","","","","","1489","0","","https://www.scopus.com/inward/record.uri?eid=2-s2.0-85163772767&partnerID=40&md5=0dbf36c3585f87406dc82db9134a0406","Conference review","Final","","Scopus","2-s2.0-85163772767"
"Dong S.; Hangel G.; Bogner W.; Widhalm G.; Rössler K.; Trattnig S.; You C.; de Graaf R.; Onofrey J.A.; Duncan J.S.","Dong, Siyuan (57404722800); Hangel, Gilbert (55844844800); Bogner, Wolfgang (26025582100); Widhalm, Georg (26041237300); Rössler, Karl (6603843120); Trattnig, Siegfried (57203957760); You, Chenyu (57203062927); de Graaf, Robin (57203077877); Onofrey, John A. (55823011300); Duncan, James S. (57210775364)","57404722800; 55844844800; 26025582100; 26041237300; 6603843120; 57203957760; 57203062927; 57203077877; 55823011300; 57210775364","Multi-scale Super-Resolution Magnetic Resonance Spectroscopic Imaging with Adjustable Sharpness","2022","Lecture Notes in Computer Science (including subseries Lecture Notes in Artificial Intelligence and Lecture Notes in Bioinformatics)","13436 LNCS","","","410","420","10","1","10.1007/978-3-031-16446-0_39","https://www.scopus.com/inward/record.uri?eid=2-s2.0-85139164533&doi=10.1007%2f978-3-031-16446-0_39&partnerID=40&md5=8c5d3e85f3899561bd2ead52851711b4","Conference paper","Final","All Open Access; Green Open Access","Scopus","2-s2.0-85139164533"
"Liu M.; Ahmad R.; Cai W.; Mukerji T.","Liu, Mingliang (57201483621); Ahmad, Rasool (57200368374); Cai, Wei (57931447700); Mukerji, Tapan (7003413039)","57201483621; 57200368374; 57931447700; 7003413039","Hierarchical Homogenization With Deep-Learning-Based Surrogate Model for Rapid Estimation of Effective Permeability From Digital Rocks","2023","Journal of Geophysical Research: Solid Earth","128","2","e2022JB025378","","","","4","10.1029/2022JB025378","https://www.scopus.com/inward/record.uri?eid=2-s2.0-85148902332&doi=10.1029%2f2022JB025378&partnerID=40&md5=ddbe09b851ebd16d4262c4afa72bef19","Article","Final","","Scopus","2-s2.0-85148902332"
"Ma J.; Chen J.","Ma, Ji (56170572800); Chen, Jinjin (57218144661)","56170572800; 57218144661","Pix2PixSSR: Spatial super-resolution synthesis and visualization for time-varying volumetric data","2023","IET Image Processing","","","","","","","0","10.1049/ipr2.12933","https://www.scopus.com/inward/record.uri?eid=2-s2.0-85171674487&doi=10.1049%2fipr2.12933&partnerID=40&md5=7cc60707bd5f80ec6c537853d6f38971","Article","Article in press","All Open Access; Gold Open Access","Scopus","2-s2.0-85171674487"
"Ignatov A.; Timofte R.; Chiang C.-M.; Kuo H.-K.; Xu Y.-S.; Lee M.-Y.; Lu A.; Cheng C.-M.; Chen C.-C.; Yong J.-Y.; Shuai H.-H.; Cheng W.-H.; Jia Z.; Xu T.; Zhang Y.; Bao L.; Sun H.; Zhang D.; Gao S.; Liu S.; Wu B.; Zhang X.; Zheng C.; Lu K.; Wang N.; Sun X.; Wu H.D.; Liu X.; Zhang W.; Yan C.; Du H.; Zheng Q.; Wang Q.; Chen W.; Duan R.; Sun M.; Zhu D.; Chen G.; Cho H.; Kim S.; Yue S.; Li C.; Zhuge Z.; Chen W.; Wang W.; Zhou Y.; Cai X.; Cai H.; Xu K.; Liu L.; Cheng Z.; Lian W.; Lian W.","Ignatov, Andrey (57194704046); Timofte, Radu (35812778400); Chiang, Cheng-Ming (57218705870); Kuo, Hsien-Kai (41461650400); Xu, Yu-Syuan (57218711398); Lee, Man-Yu (57218708250); Lu, Allen (58022564400); Cheng, Chia-Ming (56692017600); Chen, Chih-Cheng (56110227400); Yong, Jia-Ying (58023002300); Shuai, Hong-Han (50662015600); Cheng, Wen-Huang (24775341200); Jia, Zhuang (57386185000); Xu, Tianyu (57869895600); Zhang, Yijian (57870188400); Bao, Long (57218708541); Sun, Heng (57894129300); Zhang, Diankai (57278892900); Gao, Si (57652404100); Liu, Shaoli (57654064100); Wu, Biao (57653515300); Zhang, Xiaofeng (57653515400); Zheng, Chengjian (57654624700); Lu, Kaidi (57279769400); Wang, Ning (55467192400); Sun, Xiao (58603656900); Wu, HaoDong (58022564600); Liu, Xuncheng (57223242683); Zhang, Weizhan (24473907300); Yan, Caixia (57195327469); Du, Haipeng (26428651900); Zheng, Qinghua (56113889000); Wang, Qi (58022350300); Chen, Wangdu (58022350400); Duan, Ran (57210374006); Sun, Mengdi (57225864937); Zhu, Dan (57217403014); Chen, Guannan (57226557368); Cho, Hojin (57985447900); Kim, Steve (57984910600); Yue, Shijie (58160932600); Li, Chenghua (57191621469); Zhuge, Zhengyang (57985265300); Chen, Wei (58460263800); Wang, Wenxu (58022564800); Zhou, Yufeng (57478312200); Cai, Xiaochen (58022142200); Cai, Hengxing (57197714478); Xu, Kele (56413567000); Liu, Li (57221211535); Cheng, Zehua (57210104209); Lian, Wenyi (57870356600); Lian, Wenjing (57870356700)","57194704046; 35812778400; 57218705870; 41461650400; 57218711398; 57218708250; 58022564400; 56692017600; 56110227400; 58023002300; 50662015600; 24775341200; 57386185000; 57869895600; 57870188400; 57218708541; 57894129300; 57278892900; 57652404100; 57654064100; 57653515300; 57653515400; 57654624700; 57279769400; 55467192400; 58603656900; 58022564600; 57223242683; 24473907300; 57195327469; 26428651900; 56113889000; 58022350300; 58022350400; 57210374006; 57225864937; 57217403014; 57226557368; 57985447900; 57984910600; 58160932600; 57191621469; 57985265300; 58460263800; 58022564800; 57478312200; 58022142200; 57197714478; 56413567000; 57221211535; 57210104209; 57870356600; 57870356700","Power Efficient Video Super-Resolution on Mobile NPUs with Deep Learning, Mobile AI & AIM 2022 Challenge: Report","2023","Lecture Notes in Computer Science (including subseries Lecture Notes in Artificial Intelligence and Lecture Notes in Bioinformatics)","13803 LNCS","","","130","152","22","0","10.1007/978-3-031-25066-8_6","https://www.scopus.com/inward/record.uri?eid=2-s2.0-85151167744&doi=10.1007%2f978-3-031-25066-8_6&partnerID=40&md5=8dbd647cd12a3e05325fd931e6a8365c","Conference paper","Final","","Scopus","2-s2.0-85151167744"
"Ignatov A.; Timofte R.; Denna M.; Younes A.; Gankhuyag G.; Huh J.; Kim M.K.; Yoon K.; Moon H.-C.; Lee S.; Choe Y.; Jeong J.; Kim S.; Smyl M.; Latkowski T.; Kubik P.; Sokolski M.; Ma Y.; Chao J.; Zhou Z.; Gao H.; Yang Z.; Zeng Z.; Zhuge Z.; Li C.; Zhu D.; Sun M.; Duan R.; Gao Y.; Kong L.; Sun L.; Li X.; Zhang X.; Zhang J.; Wu Y.; Pan J.; Yu G.; Zhang J.; Zhang F.; Ma Z.; Wang H.; Cho H.; Kim S.; Li H.; Ma Y.; Luo Z.; Li Y.; Yu L.; Wen Z.; Wu Q.; Fan H.; Liu S.; Zhang L.; Zong Z.; Kwon J.; Zhang J.; Li M.; Fu N.; Ding G.; Zhu H.; Chen Z.; Li G.; Zhang Y.; Sun L.; Zhang D.; Yang N.; Liu F.; Zhao J.; Ayazoglu M.; Bilecen B.B.; Hirose S.; Arunruangsirilert K.; Ao L.; Leung H.C.; Wei A.; Liu J.; Liu Q.; Yu D.; Li A.; Luo L.; Zhu C.; Hong S.; Park D.; Lee J.; Lee B.H.; Lee S.; Chun S.Y.; He R.; Jiang X.; Ruan H.; Zhang X.; Liu J.; Gendy G.; Sabor N.; Hou J.; He G.","Ignatov, Andrey (57194704046); Timofte, Radu (35812778400); Denna, Maurizio (57203551168); Younes, Abdel (57224983506); Gankhuyag, Ganzorig (27867715400); Huh, Jingang (57985092600); Kim, Myeong Kyun (57984910300); Yoon, Kihwan (57984191400); Moon, Hyeon-Cheol (57846451700); Lee, Seungho (57984191500); Choe, Yoonsik (7102998299); Jeong, Jinwoo (57221000644); Kim, Sungjei (25652751100); Smyl, Maciej (57222665511); Latkowski, Tomasz (54581253800); Kubik, Pawel (57985265100); Sokolski, Michal (57984910500); Ma, Yujie (57980316200); Chao, Jiahao (57985447700); Zhou, Zhou (57985265200); Gao, Hongfan (57985447800); Yang, Zhengfeng (9044570600); Zeng, Zhenbing (55908429000); Zhuge, Zhengyang (57985265300); Li, Chenghua (57191621469); Zhu, Dan (57217403014); Sun, Mengdi (57225864937); Duan, Ran (57210374006); Gao, Yan (57984191700); Kong, Lingshun (57886746800); Sun, Long (57215283954); Li, Xiang (57216372742); Zhang, Xingdong (57984557700); Zhang, Jiawei (57194062920); Wu, Yaqi (57207458920); Pan, Jinshan (55258321100); Yu, Gaocheng (57658018200); Zhang, Jin (57658328700); Zhang, Feng (57207771718); Ma, Zhe (57656735000); Wang, Hongbin (57226259149); Cho, Hojin (57985447900); Kim, Steve (57984910600); Li, Huaen (57961149800); Ma, Yanbo (57290601200); Luo, Ziwei (57224852729); Li, Youwei (57222956827); Yu, Lei (57224851077); Wen, Zhihong (57652896100); Wu, Qi (57652896000); Fan, Haoqiang (56096618000); Liu, Shuaicheng (36466496400); Zhang, Lize (57233449400); Zong, Zhikai (57200146943); Kwon, Jeremy (57984373800); Zhang, Junxi (57885590500); Li, Mengyuan (57984191800); Fu, Nianxiang (57985265400); Ding, Guanchen (57221559608); Zhu, Han (57221180146); Chen, Zhenzhong (55737671700); Li, Gen (58160986100); Zhang, Yuanfan (57727293500); Sun, Lei (57747896200); Zhang, Dafeng (57668087200); Yang, Neo (57984733400); Liu, Fitz (57985448000); Zhao, Jerry (57985265600); Ayazoglu, Mustafa (35791665200); Bilecen, Bahri Batuhan (57758455400); Hirose, Shota (57226646143); Arunruangsirilert, Kasidis (57897818000); Ao, Luo (57985265700); Leung, Ho Chun (57191737122); Wei, Andrew (57984910700); Liu, Jie (57867696900); Liu, Qiang (58460198200); Yu, Dahai (57216456050); Li, Ao (57194654659); Luo, Lei (35275273000); Zhu, Ce (7403439404); Hong, Seongmin (8917629500); Park, Dongwon (57205630005); Lee, Joonhee (55689961400); Lee, Byeong Hyun (57980316400); Lee, Seunggyu (57979939400); Chun, Se Young (55419135100); He, Ruiyuan (57984191900); Jiang, Xuhao (57203923337); Ruan, Haihang (57749678500); Zhang, Xinjian (57219737427); Liu, Jing (58411228900); Gendy, Garas (56523253500); Sabor, Nabil (36661293200); Hou, Jingchao (57858415600); He, Guanghui (35931805200)","57194704046; 35812778400; 57203551168; 57224983506; 27867715400; 57985092600; 57984910300; 57984191400; 57846451700; 57984191500; 7102998299; 57221000644; 25652751100; 57222665511; 54581253800; 57985265100; 57984910500; 57980316200; 57985447700; 57985265200; 57985447800; 9044570600; 55908429000; 57985265300; 57191621469; 57217403014; 57225864937; 57210374006; 57984191700; 57886746800; 57215283954; 57216372742; 57984557700; 57194062920; 57207458920; 55258321100; 57658018200; 57658328700; 57207771718; 57656735000; 57226259149; 57985447900; 57984910600; 57961149800; 57290601200; 57224852729; 57222956827; 57224851077; 57652896100; 57652896000; 56096618000; 36466496400; 57233449400; 57200146943; 57984373800; 57885590500; 57984191800; 57985265400; 57221559608; 57221180146; 55737671700; 58160986100; 57727293500; 57747896200; 57668087200; 57984733400; 57985448000; 57985265600; 35791665200; 57758455400; 57226646143; 57897818000; 57985265700; 57191737122; 57984910700; 57867696900; 58460198200; 57216456050; 57194654659; 35275273000; 7403439404; 8917629500; 57205630005; 55689961400; 57980316400; 57979939400; 55419135100; 57984191900; 57203923337; 57749678500; 57219737427; 58411228900; 56523253500; 36661293200; 57858415600; 35931805200","Efficient and Accurate Quantized Image Super-Resolution on Mobile NPUs, Mobile AI & AIM 2022 Challenge: Report","2023","Lecture Notes in Computer Science (including subseries Lecture Notes in Artificial Intelligence and Lecture Notes in Bioinformatics)","13803 LNCS","","","92","129","37","8","10.1007/978-3-031-25066-8_5","https://www.scopus.com/inward/record.uri?eid=2-s2.0-85151119704&doi=10.1007%2f978-3-031-25066-8_5&partnerID=40&md5=61449bc933aacee924a7df71cb8fd2e5","Conference paper","Final","","Scopus","2-s2.0-85151119704"
"Sharma P.; Mohanram B.; Vijayashree J.; Jayashree J.; Sahoo A.R.","Sharma, Prith (58175900300); Mohanram, Brigadesh (58175425900); Vijayashree, J. (57190985580); Jayashree, J. (57191669840); Sahoo, Aditya Raj (58175668400)","58175900300; 58175425900; 57190985580; 57191669840; 58175668400","Image Enhancement using ESRGAN for CNN based X-Ray Classification","2022","Proceedings of 5th International Conference on Contemporary Computing and Informatics, IC3I 2022","","","","1965","1969","4","0","10.1109/IC3I56241.2022.10072472","https://www.scopus.com/inward/record.uri?eid=2-s2.0-85152077754&doi=10.1109%2fIC3I56241.2022.10072472&partnerID=40&md5=405d657b56f69af735249ff5062fe52b","Conference paper","Final","","Scopus","2-s2.0-85152077754"
"Li H.; Dai T.; Li Y.; Zou X.; Xia S.-T.","Li, Hongwei (57007362000); Dai, Tao (56940086700); Li, Yiming (57219508213); Zou, Xueyi (56358811100); Xia, Shu-Tao (7202892509)","57007362000; 56940086700; 57219508213; 56358811100; 7202892509","ADAPTIVE LOCAL IMPLICIT IMAGE FUNCTION FOR ARBITRARY-SCALE SUPER-RESOLUTION","2022","Proceedings - International Conference on Image Processing, ICIP","","","","4033","4037","4","3","10.1109/ICIP46576.2022.9897382","https://www.scopus.com/inward/record.uri?eid=2-s2.0-85146683122&doi=10.1109%2fICIP46576.2022.9897382&partnerID=40&md5=80d4fe86dc9c2cacdc1b3ea9aa32c398","Conference paper","Final","All Open Access; Green Open Access","Scopus","2-s2.0-85146683122"
"Devkota S.; Pattanaik S.","Devkota, Sudarshan (57221083449); Pattanaik, Sumanta (7003680065)","57221083449; 7003680065","Deep Learning Based Super-Resolution for Medical Volume Visualization with Direct Volume Rendering","2022","Lecture Notes in Computer Science (including subseries Lecture Notes in Artificial Intelligence and Lecture Notes in Bioinformatics)","13598 LNCS","","","103","114","11","1","10.1007/978-3-031-20713-6_8","https://www.scopus.com/inward/record.uri?eid=2-s2.0-85145230035&doi=10.1007%2f978-3-031-20713-6_8&partnerID=40&md5=c7c75be0f4b9c415445a289e90e8ec4f","Conference paper","Final","All Open Access; Green Open Access","Scopus","2-s2.0-85145230035"
"Imran M.; Yin H.; Chen T.; Nguyen Q.V.H.; Zhou A.; Zheng K.","Imran, Mubashir (57195595393); Yin, Hongzhi (55007318200); Chen, Tong (57196727070); Nguyen, Quoc Viet Hung (57190497691); Zhou, Alexander (57202338693); Zheng, Kai (36609714100)","57195595393; 55007318200; 57196727070; 57190497691; 57202338693; 36609714100","ReFRS: Resource-efficient Federated Recommender System for Dynamic and Diversified User Preferences","2023","ACM Transactions on Information Systems","41","3","65","","","","6","10.1145/3560486","https://www.scopus.com/inward/record.uri?eid=2-s2.0-85152948340&doi=10.1145%2f3560486&partnerID=40&md5=68380e513bc9cc936661444dde4d947f","Article","Final","All Open Access; Green Open Access","Scopus","2-s2.0-85152948340"
"Shang L.; Wang J.; Schäfer D.; Heckelei T.; Gall J.; Appel F.; Storm H.","Shang, Linmei (57222027274); Wang, Jifeng (58243573000); Schäfer, David (57194435519); Heckelei, Thomas (6507407712); Gall, Juergen (23396675200); Appel, Franziska (36681799100); Storm, Hugo (42062218700)","57222027274; 58243573000; 57194435519; 6507407712; 23396675200; 36681799100; 42062218700","Surrogate modelling of a detailed farm-level model using deep learning","2023","Journal of Agricultural Economics","","","","","","","0","10.1111/1477-9552.12543","https://www.scopus.com/inward/record.uri?eid=2-s2.0-85159006118&doi=10.1111%2f1477-9552.12543&partnerID=40&md5=e5aba248dfe450edfdd2d81573482cb5","Article","Article in press","All Open Access; Hybrid Gold Open Access","Scopus","2-s2.0-85159006118"
"Stockhausen A.; Rodriguez-Gatica J.E.; Schweihoff J.; Schwarz M.K.; Kubitscheck U.","Stockhausen, Anne (57216732160); Rodriguez-Gatica, Juan Eduardo (57207693606); Schweihoff, Jens (57216734866); Schwarz, Martin Karl (7402724757); Kubitscheck, Ulrich (55952420800)","57216732160; 57207693606; 57216734866; 7402724757; 55952420800","Airy beam light sheet microscopy boosted by deep learning deconvolution","2023","Optics Express","31","6","","10918","10935","17","0","10.1364/OE.485699","https://www.scopus.com/inward/record.uri?eid=2-s2.0-85150366338&doi=10.1364%2fOE.485699&partnerID=40&md5=40c8431b81b21e8a698d9be339458cdb","Article","Final","All Open Access; Gold Open Access","Scopus","2-s2.0-85150366338"
"Wang Y.; Wu X.; Qu T.","Wang, Yiwen (57219185467); Wu, Xihong (7407061832); Qu, Tianshu (8956805100)","57219185467; 7407061832; 8956805100","UP-WGAN: Upscaling Ambisonic Sound Scenes Using Wasserstein Generative Adversarial Networks","2022","AES Europe Spring 2022 - 152nd Audio Engineering Society Convention 2022","","","","284","292","8","0","","https://www.scopus.com/inward/record.uri?eid=2-s2.0-85136331508&partnerID=40&md5=b8c8e1e39ce2b8cf63bfb22eab7209a5","Conference paper","Final","","Scopus","2-s2.0-85136331508"
"Wang R.; Zhang R.; Bao C.; Qiu L.; Yang D.","Wang, Rongqian (57567684200); Zhang, Ruixuan (57613560900); Bao, Chenglong (55365012900); Qiu, Lingyun (55120165100); Yang, Dinghui (57204698399)","57567684200; 57613560900; 55365012900; 55120165100; 57204698399","Adapting the Residual Dense Network for Seismic Data Denoising and Upscaling","2022","Geophysics","87","4","","","","","3","10.1190/geo2021-0294.1","https://www.scopus.com/inward/record.uri?eid=2-s2.0-85128787874&doi=10.1190%2fgeo2021-0294.1&partnerID=40&md5=59d5d483020431eb1f40d28ab3d80ba3","Article","Final","","Scopus","2-s2.0-85128787874"
"Sharma A.; Shrivastava B.P.; Priya A.","Sharma, Ajay (57752264200); Shrivastava, Bhavana Prakash (57202434941); Priya, Aayushi (58315213800)","57752264200; 57202434941; 58315213800","Multilevel progressive recursive dilated networks with correlation filter (MPRDNCF) for image super-resolution","2023","Multimedia Systems","29","5","","2455","2467","12","0","10.1007/s00530-023-01126-6","https://www.scopus.com/inward/record.uri?eid=2-s2.0-85161966920&doi=10.1007%2fs00530-023-01126-6&partnerID=40&md5=bf35db45ff2c17b354000052205be5ec","Article","Final","","Scopus","2-s2.0-85161966920"
"Wang L.; Wang L.; Wang H.; Wang X.; Bruzzone L.","Wang, Lifeng (57226450880); Wang, Liguo (55745497100); Wang, Heng (58566422800); Wang, Xiaoyi (57074222100); Bruzzone, Lorenzo (7006892410)","57226450880; 55745497100; 58566422800; 57074222100; 7006892410","SPCNet: A Subpixel Convolution-Based Change Detection Network for Hyperspectral Images with Different Spatial Resolutions","2022","IEEE Transactions on Geoscience and Remote Sensing","60","","5533314","","","","7","10.1109/TGRS.2022.3189188","https://www.scopus.com/inward/record.uri?eid=2-s2.0-85134248285&doi=10.1109%2fTGRS.2022.3189188&partnerID=40&md5=6ed5b32d43a74af5542a8706026a3889","Article","Final","","Scopus","2-s2.0-85134248285"
"Boby A.; Brown D.","Boby, Alden (57680180600); Brown, Dane (58237408000)","57680180600; 58237408000","Improving Licence Plate Detection Using Generative Adversarial Networks","2022","Lecture Notes in Computer Science (including subseries Lecture Notes in Artificial Intelligence and Lecture Notes in Bioinformatics)","13256 LNCS","","","588","601","13","4","10.1007/978-3-031-04881-4_47","https://www.scopus.com/inward/record.uri?eid=2-s2.0-85129813795&doi=10.1007%2f978-3-031-04881-4_47&partnerID=40&md5=9bf5e44219740a5f56e81fff653230da","Conference paper","Final","","Scopus","2-s2.0-85129813795"
"Shi Y.; Kissling W.D.","Shi, Yifang (57362036900); Kissling, W. Daniel (8857319300)","57362036900; 8857319300","Performance, effectiveness and computational efficiency of powerline extraction methods for quantifying ecosystem structure from light detection and ranging","2023","GIScience and Remote Sensing","60","1","2260637","","","","0","10.1080/15481603.2023.2260637","https://www.scopus.com/inward/record.uri?eid=2-s2.0-85171974673&doi=10.1080%2f15481603.2023.2260637&partnerID=40&md5=3e7ea13c9e60ac08e74b56c4cfc07bfb","Article","Final","All Open Access; Gold Open Access","Scopus","2-s2.0-85171974673"
"Chugh A.; Jain C.; Kumar A.","Chugh, Aarti (56439156800); Jain, Charu (36131505200); Kumar, Anil (57214420522)","56439156800; 36131505200; 57214420522","Design of Artificial Intelligence Enabled Game Engine","2022","ACM International Conference Proceeding Series","","","99","","","","0","10.1145/3590837.3590936","https://www.scopus.com/inward/record.uri?eid=2-s2.0-85162239130&doi=10.1145%2f3590837.3590936&partnerID=40&md5=3d4fb3744fe8c47764b08652e703c4fc","Conference paper","Final","","Scopus","2-s2.0-85162239130"
"Sharma A.; Shrivastava B.P.","Sharma, Ajay (57752264200); Shrivastava, Bhavana Prakash (57202434941)","57752264200; 57202434941","Medical image super-resolution using correlation filter interleaved progressive convolution network (CFIPC)","2022","Electronics Letters","58","9","","360","362","2","3","10.1049/ell2.12467","https://www.scopus.com/inward/record.uri?eid=2-s2.0-85126055529&doi=10.1049%2fell2.12467&partnerID=40&md5=21c591877658634d8c81ff74089eed88","Article","Final","All Open Access; Gold Open Access","Scopus","2-s2.0-85126055529"
"Yun J.-S.; Yoo S.B.","Yun, Jun-Seok (57415662200); Yoo, Seok Bong (57211812382)","57415662200; 57211812382","Kernel-attentive weight modulation memory network for optical blur kernel-aware image super-resolution","2023","Optics Letters","48","10","","2740","2743","3","0","10.1364/OL.488562","https://www.scopus.com/inward/record.uri?eid=2-s2.0-85159403737&doi=10.1364%2fOL.488562&partnerID=40&md5=5a60343eead6d08c4af1d67955207047","Article","Final","","Scopus","2-s2.0-85159403737"
"Weiss S.; Han J.; Wang C.; Westermann R.","Weiss, Sebastian (57210507258); Han, Jun (57209633331); Wang, Chaoli (57203797020); Westermann, Rüdiger (7005320805)","57210507258; 57209633331; 57203797020; 7005320805","Deep Learning-Based Upscaling for In Situ Volume Visualization","2022","Mathematics and Visualization","","","","331","352","21","2","10.1007/978-3-030-81627-8_15","https://www.scopus.com/inward/record.uri?eid=2-s2.0-85130094450&doi=10.1007%2f978-3-030-81627-8_15&partnerID=40&md5=77eb0634b08f34b6d4af0f667b3a6133","Book chapter","Final","","Scopus","2-s2.0-85130094450"
"James O.; Singh T.R.; Singh T.R.","James, Oinam (58194425200); Singh, Th. Rupachandra (58525074800); Singh, T.Romen (57205782788)","58194425200; 58525074800; 57205782788","Image Super Resolution Based on Machine Learning for Enhancing Quality Image","2023","Proceedings of 2023 International Conference on Intelligent Systems, Advanced Computing and Communication, ISACC 2023","","","","","","","0","10.1109/ISACC56298.2023.10084087","https://www.scopus.com/inward/record.uri?eid=2-s2.0-85153366950&doi=10.1109%2fISACC56298.2023.10084087&partnerID=40&md5=44d55949759e9c015cbadc142eb6a148","Conference paper","Final","","Scopus","2-s2.0-85153366950"
"Ahmad W.; Ali H.; Shah Z.; Azmat S.","Ahmad, Waqar (57206505603); Ali, Hazrat (56501336300); Shah, Zubair (56428700200); Azmat, Shoaib (55263841400)","57206505603; 56501336300; 56428700200; 55263841400","A new generative adversarial network for medical images super resolution","2022","Scientific Reports","12","1","9533","","","","23","10.1038/s41598-022-13658-4","https://www.scopus.com/inward/record.uri?eid=2-s2.0-85131708599&doi=10.1038%2fs41598-022-13658-4&partnerID=40&md5=67779d38e3e111f1a10d0fc7e796f9cd","Article","Final","All Open Access; Gold Open Access; Green Open Access","Scopus","2-s2.0-85131708599"
"Bischoff L.M.; Peeters J.M.; Weinhold L.; Krausewitz P.; Ellinger J.; Katemann C.; Isaak A.; Weber O.M.; Kuetting D.; Attenberger U.; Pieper C.C.; Sprinkart A.M.; Luetkens J.A.","Bischoff, Leon M. (57229758400); Peeters, Johannes M. (8150057100); Weinhold, Leonie (57192097884); Krausewitz, Philipp (55618833600); Ellinger, Jörg (8527709600); Katemann, Christoph (57203148005); Isaak, Alexander (56556744100); Weber, Oliver M. (7004486574); Kuetting, Daniel (56431209200); Attenberger, Ulrike (23099518200); Pieper, Claus C. (55427486900); Sprinkart, Alois M. (54417937100); Luetkens, Julian A. (56140582400)","57229758400; 8150057100; 57192097884; 55618833600; 8527709600; 57203148005; 56556744100; 7004486574; 56431209200; 23099518200; 55427486900; 54417937100; 56140582400","Deep Learning Super-Resolution Reconstruction for Fast and Motion-Robust T2-weighted Prostate MRI","2023","Radiology","308","3","e230427","","","","1","10.1148/radiol.230427","https://www.scopus.com/inward/record.uri?eid=2-s2.0-85172174236&doi=10.1148%2fradiol.230427&partnerID=40&md5=4395a044c7119b9f835a9abb2c1758d4","Article","Final","","Scopus","2-s2.0-85172174236"
"Kushwaha A.; Goswami L.; Singhvi M.; Kim B.S.","Kushwaha, Anamika (57147205200); Goswami, Lalit (57190763767); Singhvi, Mamata (35225331500); Kim, Beom Soo (56542024700)","57147205200; 57190763767; 35225331500; 56542024700","Biodegradation of poly(ethylene terephthalate): Mechanistic insights, advances, and future innovative strategies","2023","Chemical Engineering Journal","457","","141230","","","","11","10.1016/j.cej.2022.141230","https://www.scopus.com/inward/record.uri?eid=2-s2.0-85146065557&doi=10.1016%2fj.cej.2022.141230&partnerID=40&md5=14032ea6aec5f264b37caddc6f96d6c3","Review","Final","","Scopus","2-s2.0-85146065557"
