"Authors","Author full names","Author(s) ID","Title","Year","Source title","Volume","Issue","Art. No.","Page start","Page end","Page count","Cited by","DOI","Link","Document Type","Publication Stage","Open Access","Source","EID"
"Ignatov A.; Timofte R.; Denna M.; Younes A.; Lek A.; Ayazoglu M.; Liu J.; Du Z.; Guo J.; Zhou X.; Jia H.; Yan Y.; Zhang Z.; Chen Y.; Peng Y.; Lin Y.; Zhang X.; Zeng H.; Zeng K.; Li P.; Liu Z.; Xue S.; Wang S.","Ignatov, Andrey (57194704046); Timofte, Radu (35812778400); Denna, Maurizio (57203551168); Younes, Abdel (57224983506); Lek, Andrew (57224980752); Ayazoglu, Mustafa (35791665200); Liu, Jie (57867696900); Du, Zongcai (57224769813); Guo, Jiaming (57224499588); Zhou, Xueyi (57224523911); Jia, Hao (57224514073); Yan, Youliang (57214450323); Zhang, Zexin (57224507827); Chen, Yixin (57224516358); Peng, Yunbo (57221146561); Lin, Yue (57221146416); Zhang, Xindong (57224985610); Zeng, Hui (56486683200); Zeng, Kun (56047736500); Li, Peirong (57224982703); Liu, Zhihuang (57224982740); Xue, Shiqi (57224975863); Wang, Shengpeng (57224987175)","57194704046; 35812778400; 57203551168; 57224983506; 57224980752; 35791665200; 57867696900; 57224769813; 57224499588; 57224523911; 57224514073; 57214450323; 57224507827; 57224516358; 57221146561; 57221146416; 57224985610; 56486683200; 56047736500; 57224982703; 57224982740; 57224975863; 57224987175","Real-time quantized image super-resolution on mobile NPUs, mobile AI 2021 challenge: Report","2021","IEEE Computer Society Conference on Computer Vision and Pattern Recognition Workshops","","","","2525","2534","9","46","10.1109/CVPRW53098.2021.00286","https://www.scopus.com/inward/record.uri?eid=2-s2.0-85116024246&doi=10.1109%2fCVPRW53098.2021.00286&partnerID=40&md5=c82dcfd6503c7409e6f7b40857dc8d7d","Conference paper","Final","All Open Access; Green Open Access","Scopus","2-s2.0-85116024246"
"Sharma P.K.; Basavaraju S.; Sur A.","Sharma, Prasen Kumar (57212458375); Basavaraju, Sathisha (57210657985); Sur, Arijit (24345148700)","57212458375; 57210657985; 24345148700","High-resolution image de-raining using conditional GAN with sub-pixel upscaling","2021","Multimedia Tools and Applications","80","1","","1075","1094","19","6","10.1007/s11042-020-09642-7","https://www.scopus.com/inward/record.uri?eid=2-s2.0-85090306571&doi=10.1007%2fs11042-020-09642-7&partnerID=40&md5=36b385c39d355a7f29af38db9618e874","Article","Final","","Scopus","2-s2.0-85090306571"
"Deng X.; Song P.; Rodrigues M.R.D.; Dragotti P.L.","Deng, Xin (56071493400); Song, Pingfan (57191198668); Rodrigues, Miguel R. D. (57210526627); Dragotti, Pier Luigi (6701786340)","56071493400; 57191198668; 57210526627; 6701786340","RADAR: Robust Algorithm for Depth Image Super Resolution Based on FRI Theory and Multimodal Dictionary Learning","2020","IEEE Transactions on Circuits and Systems for Video Technology","30","8","8741062","2447","2462","15","8","10.1109/TCSVT.2019.2923901","https://www.scopus.com/inward/record.uri?eid=2-s2.0-85089518536&doi=10.1109%2fTCSVT.2019.2923901&partnerID=40&md5=3b1f19c25b5781539b76f7a400af4978","Article","Final","All Open Access; Green Open Access","Scopus","2-s2.0-85089518536"
"Yang Z.; Dong Y.; Song L.; Xie R.; Li L.; Feng Y.","Yang, Zaixin (57215138338); Dong, Yu (57193066412); Song, Li (7402537534); Xie, Rong (7202459061); Li, Lin (57216895582); Feng, Yanan (57222612755)","57215138338; 57193066412; 7402537534; 7202459061; 57216895582; 57222612755","Native resolution detection for 4K-UHD videos","2020","IEEE International Symposium on Broadband Multimedia Systems and Broadcasting, BMSB","2020-October","","9379531","","","","1","10.1109/BMSB49480.2020.9379531","https://www.scopus.com/inward/record.uri?eid=2-s2.0-85103453299&doi=10.1109%2fBMSB49480.2020.9379531&partnerID=40&md5=7b9ffde873103fc85e1c86eb45e4107c","Conference paper","Final","","Scopus","2-s2.0-85103453299"
"Gu S.; Lugmayr A.; Danelljan M.; Fritsche M.; Lamour J.; Timofte R.","Gu, Shuhang (56421224700); Lugmayr, Andreas (57215970874); Danelljan, Martin (56422503300); Fritsche, Manuel (57205615260); Lamour, Julien (57225433209); Timofte, Radu (35812778400)","56421224700; 57215970874; 56422503300; 57205615260; 57225433209; 35812778400","DIV8K: DIVerse 8K resolution image dataset","2019","Proceedings - 2019 International Conference on Computer Vision Workshop, ICCVW 2019","","","9021973","3512","3516","4","44","10.1109/ICCVW.2019.00435","https://www.scopus.com/inward/record.uri?eid=2-s2.0-85082455949&doi=10.1109%2fICCVW.2019.00435&partnerID=40&md5=87f5af4c274aabc8b85fe1dfdef59629","Conference paper","Final","","Scopus","2-s2.0-85082455949"
"Gnacek M.; Heatwole C.; Fan D.; Hoffman M.","Gnacek, Matthew (57486104500); Heatwole, Cory (57218710322); Fan, David (57194595103); Hoffman, Marc (55211595300)","57486104500; 57218710322; 57194595103; 55211595300","Convolutional Neural Networks for Enhanced Compression Techniques","2021","Proceedings of the IEEE National Aerospace Electronics Conference, NAECON","2021-August","","","392","399","7","1","10.1109/NAECON49338.2021.9696409","https://www.scopus.com/inward/record.uri?eid=2-s2.0-85126210469&doi=10.1109%2fNAECON49338.2021.9696409&partnerID=40&md5=acb5fa27e252184166d82c9dca8d2718","Conference paper","Final","","Scopus","2-s2.0-85126210469"
"Qiao C.; Li D.; Guo Y.; Liu C.; Jiang T.; Dai Q.; Li D.","Qiao, Chang (57193796384); Li, Di (57201864678); Guo, Yuting (56942610200); Liu, Chong (57204292033); Jiang, Tao (58188524300); Dai, Qionghai (7202735131); Li, Dong (56148369900)","57193796384; 57201864678; 56942610200; 57204292033; 58188524300; 7202735131; 56148369900","Evaluation and development of deep neural networks for image super-resolution in optical microscopy","2021","Nature Methods","18","2","","194","202","8","154","10.1038/s41592-020-01048-5","https://www.scopus.com/inward/record.uri?eid=2-s2.0-85099911174&doi=10.1038%2fs41592-020-01048-5&partnerID=40&md5=76bf142bac33a5a008fae90db690eb4b","Article","Final","","Scopus","2-s2.0-85099911174"
"Qiu C.; Schmitt M.; Geiß C.; Chen T.-H.K.; Zhu X.X.","Qiu, Chunping (57194601941); Schmitt, Michael (7401931279); Geiß, Christian (39862777100); Chen, Tzu-Hsin Karen (57204471608); Zhu, Xiao Xiang (55696622200)","57194601941; 7401931279; 39862777100; 57204471608; 55696622200","A framework for large-scale mapping of human settlement extent from Sentinel-2 images via fully convolutional neural networks","2020","ISPRS Journal of Photogrammetry and Remote Sensing","163","","","152","170","18","40","10.1016/j.isprsjprs.2020.01.028","https://www.scopus.com/inward/record.uri?eid=2-s2.0-85081905217&doi=10.1016%2fj.isprsjprs.2020.01.028&partnerID=40&md5=bdb43d4ecf04792d86239b29a4e51fae","Article","Final","All Open Access; Green Open Access; Hybrid Gold Open Access","Scopus","2-s2.0-85081905217"
"Jiang Z.; Zhu H.; Lu Y.; Ju G.; Men A.","Jiang, Zhuqing (55834971300); Zhu, Honghui (57215845241); Lu, Yue (57208653526); Ju, Guodong (57210574497); Men, Aidong (7003758403)","55834971300; 57215845241; 57208653526; 57210574497; 7003758403","Lightweight Super-Resolution Using Deep Neural Learning","2020","IEEE Transactions on Broadcasting","66","4","9044197","814","823","9","16","10.1109/TBC.2020.2977513","https://www.scopus.com/inward/record.uri?eid=2-s2.0-85082068642&doi=10.1109%2fTBC.2020.2977513&partnerID=40&md5=a55764d3a06487d59b3e676218f1cb51","Article","Final","All Open Access; Hybrid Gold Open Access","Scopus","2-s2.0-85082068642"
"Mo F.; Cheng L.; Wu H.; Chang Y.","Mo, Fei (57226808025); Cheng, Lianglun (7403337601); Wu, Heng (56218282700); Chang, Yidan (57478975500)","57226808025; 7403337601; 56218282700; 57478975500","Single Infrared Image Super-Resolution with Lightweight Self-corrected Attention Network","2021","ACM International Conference Proceeding Series","","","","330","337","7","0","10.1145/3488933.3488992","https://www.scopus.com/inward/record.uri?eid=2-s2.0-85125868931&doi=10.1145%2f3488933.3488992&partnerID=40&md5=635d8bd56d52e7a7fccbe5b5361f8b98","Conference paper","Final","","Scopus","2-s2.0-85125868931"
"Bubba T.A.; Galinier M.; Lassas M.; Prato M.; Ratti L.; Siltanen S.","Bubba, Tatiana A. (57016858300); Galinier, Mathilde (57202736790); Lassas, Matti (6604064173); Prato, Marco (23493403900); Ratti, Luca (57193528890); Siltanen, Samuli (6701640093)","57016858300; 57202736790; 6604064173; 23493403900; 57193528890; 6701640093","Deep Neural Networks for Inverse Problems with Pseudodifferential Operators: An Application to Limited-Angle Tomography","2021","SIAM Journal on Imaging Sciences","14","2","","470","505","35","8","10.1137/20M1343075","https://www.scopus.com/inward/record.uri?eid=2-s2.0-85109133705&doi=10.1137%2f20M1343075&partnerID=40&md5=55f6fadd9beb69097d5a13409fde9f30","Article","Final","All Open Access; Green Open Access","Scopus","2-s2.0-85109133705"
"Kist A.M.; Dollinger M.","Kist, Andreas M. (57204454654); Dollinger, Michael (8884952400)","57204454654; 8884952400","Efficient Biomedical Image Segmentation on EdgeTPUs at Point of Care","2020","IEEE Access","8","","9151951","139356","139366","10","22","10.1109/ACCESS.2020.3012722","https://www.scopus.com/inward/record.uri?eid=2-s2.0-85089594272&doi=10.1109%2fACCESS.2020.3012722&partnerID=40&md5=a16863e68f82069cbd9ebb4a8e89b120","Article","Final","All Open Access; Gold Open Access; Green Open Access","Scopus","2-s2.0-85089594272"
"Wang J.; Kuffer M.; Roy D.; Pfeffer K.","Wang, Jiong (57112782200); Kuffer, Monika (36084735700); Roy, Debraj (57213481911); Pfeffer, Karin (7006882442)","57112782200; 36084735700; 57213481911; 7006882442","Deprivation pockets through the lens of convolutional neural networks","2019","Remote Sensing of Environment","234","","111448","","","","32","10.1016/j.rse.2019.111448","https://www.scopus.com/inward/record.uri?eid=2-s2.0-85073465037&doi=10.1016%2fj.rse.2019.111448&partnerID=40&md5=67a4ff369040ec3a6f38af1b13017e14","Article","Final","All Open Access; Green Open Access; Hybrid Gold Open Access","Scopus","2-s2.0-85073465037"
"Wang Y.; Cheung S.W.; Chung E.T.; Efendiev Y.; Wang M.","Wang, Yating (57190308931); Cheung, Siu Wun (56545087100); Chung, Eric T. (7202733677); Efendiev, Yalchin (12039192600); Wang, Min (57200243872)","57190308931; 56545087100; 7202733677; 12039192600; 57200243872","Deep multiscale model learning","2020","Journal of Computational Physics","406","","109071","","","","35","10.1016/j.jcp.2019.109071","https://www.scopus.com/inward/record.uri?eid=2-s2.0-85077756823&doi=10.1016%2fj.jcp.2019.109071&partnerID=40&md5=e9474101c2053cbf780cff0b317fafb5","Article","Final","All Open Access; Bronze Open Access; Green Open Access","Scopus","2-s2.0-85077756823"
"Wang Y.; Tohidypour H.R.; Pourazad M.T.; Nasiopoulos P.; Leung V.C.M.","Wang, Y. (57266979900); Tohidypour, H.R. (36455368200); Pourazad, M.T. (6507167513); Nasiopoulos, P. (6701848250); Leung, V.C.M. (7102336029)","57266979900; 36455368200; 6507167513; 6701848250; 7102336029","Deep Learning-Based HDR Image Upscaling Approach for 8K UHD Applications","2022","Digest of Technical Papers - IEEE International Conference on Consumer Electronics","2022-January","","","","","","0","10.1109/ICCE53296.2022.9730460","https://www.scopus.com/inward/record.uri?eid=2-s2.0-85127030524&doi=10.1109%2fICCE53296.2022.9730460&partnerID=40&md5=96ee756d2705b4e8693d6cf429e2a9b5","Conference paper","Final","","Scopus","2-s2.0-85127030524"
"Wang X.; Zhang J.; Mao S.; Periaswamy S.C.G.; Patton J.","Wang, Xiangyu (57195471470); Zhang, Jian (57189691172); Mao, Shiwen (57201755539); Periaswamy, Senthilkumar Cg (50561797100); Patton, Justin (57197181606)","57195471470; 57189691172; 57201755539; 50561797100; 57197181606","MulTLoc: RF Hologram Tensor Filtering and Upscaling for Locating Multiple RFID Tags","2021","Proceedings - International Conference on Computer Communications and Networks, ICCCN","2021-July","","","","","","0","10.1109/ICCCN52240.2021.9522256","https://www.scopus.com/inward/record.uri?eid=2-s2.0-85114965730&doi=10.1109%2fICCCN52240.2021.9522256&partnerID=40&md5=887e8c36ab711d23f48e863adc0d5d9a","Conference paper","Final","","Scopus","2-s2.0-85114965730"
"Märtens M.; Izzo D.; Krzic A.; Cox D.","Märtens, Marcus (36938152500); Izzo, Dario (16021918800); Krzic, Andrej (57199644951); Cox, Daniël (57215652608)","36938152500; 16021918800; 57199644951; 57215652608","Super-resolution of PROBA-V images using convolutional neural networks","2019","Astrodynamics","3","4","","387","402","15","44","10.1007/s42064-019-0059-8","https://www.scopus.com/inward/record.uri?eid=2-s2.0-85081573720&doi=10.1007%2fs42064-019-0059-8&partnerID=40&md5=d7e98b1dab609f8e07ea71566a986583","Article","Final","All Open Access; Green Open Access","Scopus","2-s2.0-85081573720"
"Cornillère V.; Djelouah A.; Yifan W.; Sorkine-Hornung O.; Schroers C.","Cornillère, Victor (57211031070); Djelouah, Abdelaziz (55430052800); Yifan, Wang (57955062900); Sorkine-Hornung, Olga (55693591100); Schroers, Christopher (55351985500)","57211031070; 55430052800; 57955062900; 55693591100; 55351985500","Blind image super-resolution with spatially variant degradations","2019","ACM Transactions on Graphics","38","6","166","","","","51","10.1145/3355089.3356575","https://www.scopus.com/inward/record.uri?eid=2-s2.0-85078887307&doi=10.1145%2f3355089.3356575&partnerID=40&md5=7528d7aabeff48812199747206021919","Article","Final","","Scopus","2-s2.0-85078887307"
"Ignatov A.; Romero A.; Kim H.; Timofte R.; Ho C.M.; Meng Z.; Lee K.M.; Chen Y.; Wang Y.; Long Z.; Wang C.; Chen Y.; Xu B.; Gu S.; Duan L.; Li W.; Bofei W.; Diankai Z.; Chengjian Z.; Shaoli L.; Si G.; Xiaofeng Z.; Kaidi L.; Tianyu X.; Hui Z.; Gao X.; Wang X.; Guo J.; Zhou X.; Jia H.; Yan Y.","Ignatov, Andrey (57194704046); Romero, Andres (57205197421); Kim, Heewon (57195937107); Timofte, Radu (35812778400); Ho, Chiu Man (57218713605); Meng, Zibo (57222589286); Lee, Kyoung Mu (26642943400); Chen, Yuxiang (57205491563); Wang, Yutong (57225066532); Long, Zeyu (57224505884); Wang, Chenhao (57224528026); Chen, Yifei (57224516351); Xu, Boshen (57224517414); Gu, Shuhang (56421224700); Duan, Lixin (57205084445); Li, Wen (54380409600); Bofei, Wang (57214472314); Diankai, Zhang (57224519204); Chengjian, Zheng (57224519719); Shaoli, Liu (57224525278); Si, Gao (57224510448); Xiaofeng, Zhang (55194477900); Kaidi, Lu (57224518534); Tianyu, Xu (57224506995); Hui, Zheng (57200213383); Gao, Xinbo (7403873424); Wang, Xiumei (35786636600); Guo, Jiaming (57224499588); Zhou, Xueyi (57224523911); Jia, Hao (57224514073); Yan, Youliang (57214450323)","57194704046; 57205197421; 57195937107; 35812778400; 57218713605; 57222589286; 26642943400; 57205491563; 57225066532; 57224505884; 57224528026; 57224516351; 57224517414; 56421224700; 57205084445; 54380409600; 57214472314; 57224519204; 57224519719; 57224525278; 57224510448; 55194477900; 57224518534; 57224506995; 57200213383; 7403873424; 35786636600; 57224499588; 57224523911; 57224514073; 57214450323","Real-time video super-resolution on smartphones with deep learning, mobile AI 2021 challenge: Report","2021","IEEE Computer Society Conference on Computer Vision and Pattern Recognition Workshops","","","","2535","2544","9","35","10.1109/CVPRW53098.2021.00287","https://www.scopus.com/inward/record.uri?eid=2-s2.0-85116059130&doi=10.1109%2fCVPRW53098.2021.00287&partnerID=40&md5=eb400e73c93698d972ae10db3cda5eff","Conference paper","Final","All Open Access; Green Open Access","Scopus","2-s2.0-85116059130"
"Jeihouni P.; Dehzangi O.; Amireskandari A.; Rezai A.; Nasrabadi N.M.","Jeihouni, Paria (57215874065); Dehzangi, Omid (23396296800); Amireskandari, Annahita (55135990500); Rezai, Ali (58520360700); Nasrabadi, Nasser M. (7006312852)","57215874065; 23396296800; 55135990500; 58520360700; 7006312852","GAN-BASED SUPER-RESOLUTION AND SEGMENTATION OF RETINAL LAYERS IN OPTICAL COHERENCE TOMOGRAPHY SCANS","2021","Proceedings - International Conference on Image Processing, ICIP","2021-September","","","46","50","4","3","10.1109/ICIP42928.2021.9506291","https://www.scopus.com/inward/record.uri?eid=2-s2.0-85125564702&doi=10.1109%2fICIP42928.2021.9506291&partnerID=40&md5=21a4d6b1bd69496018823aabf0e78083","Conference paper","Final","All Open Access; Green Open Access","Scopus","2-s2.0-85125564702"
"Greiner T.L.; Kolbjørnsen O.; Lie J.E.; Nilsen E.H.; Evensen A.K.; Gelius L.","Greiner, Thomas Larsen (57214913204); Kolbjørnsen, Odd (6602713000); Lie, Jan Erik (55850721200); Nilsen, Espen Harris (57194181365); Evensen, Andreas Kjelsrud (57194039943); Gelius, Leiv (6701524775)","57214913204; 6602713000; 55850721200; 57194181365; 57194039943; 6701524775","Cross-streamer wavefield interpolation using deep convolutional neural network","2019","SEG Technical Program Expanded Abstracts","","","","2207","2211","4","3","10.1190/segam2019-3214009.1","https://www.scopus.com/inward/record.uri?eid=2-s2.0-85121872670&doi=10.1190%2fsegam2019-3214009.1&partnerID=40&md5=cd58121bf905b7e576970f118958f8ce","Conference paper","Final","All Open Access; Green Open Access","Scopus","2-s2.0-85121872670"
"Bing X.; Zhang W.; Zheng L.; Zhang Y.","Bing, Xinyang (57205364795); Zhang, Wenwu (57214694116); Zheng, Liying (8339952700); Zhang, Yanbo (57216699498)","57205364795; 57214694116; 8339952700; 57216699498","Medical Image Super Resolution Using Improved Generative Adversarial Networks","2019","IEEE Access","7","","8854062","145030","145038","8","30","10.1109/ACCESS.2019.2944862","https://www.scopus.com/inward/record.uri?eid=2-s2.0-85078922885&doi=10.1109%2fACCESS.2019.2944862&partnerID=40&md5=5ad0239e4f9565735c9fd10bc206c066","Article","Final","All Open Access; Gold Open Access","Scopus","2-s2.0-85078922885"
"Amirpour H.; Pasandi H.B.; Timmerer C.; Ghanbari M.","Amirpour, Hadi (56038838600); Pasandi, Hannaneh Barahouei (57208134364); Timmerer, Christian (8636751500); Ghanbari, Mohammad (7006530936)","56038838600; 57208134364; 8636751500; 7006530936","Improving Per-title Encoding for HTTP Adaptive Streaming by Utilizing Video Super-resolution","2021","2021 International Conference on Visual Communications and Image Processing, VCIP 2021 - Proceedings","","","","","","","1","10.1109/VCIP53242.2021.9675403","https://www.scopus.com/inward/record.uri?eid=2-s2.0-85125270932&doi=10.1109%2fVCIP53242.2021.9675403&partnerID=40&md5=82efda8c4f5e339b70f0ed5c3dc7467d","Conference paper","Final","","Scopus","2-s2.0-85125270932"
"Dahiya P.; Garg S.","Dahiya, Parv (57352103800); Garg, Sahil (57351959300)","57352103800; 57351959300","Dimensionality Reduction Using Variational Autoencoders","2022","Lecture Notes in Networks and Systems","238","","","255","262","7","0","10.1007/978-981-16-2641-8_24","https://www.scopus.com/inward/record.uri?eid=2-s2.0-85119889714&doi=10.1007%2f978-981-16-2641-8_24&partnerID=40&md5=b59df9cbdd0cb2431e7d17592398f941","Conference paper","Final","","Scopus","2-s2.0-85119889714"
"Brunier G.; Michaud E.; Fleury J.; Anthony E.J.; Morvan S.; Gardel A.","Brunier, Guillaume (56897062100); Michaud, Emma (7004184782); Fleury, Jules (55569155400); Anthony, Edward J. (36184444700); Morvan, Sylvain (57202010753); Gardel, Antoine (8659780900)","56897062100; 7004184782; 55569155400; 36184444700; 57202010753; 8659780900","Assessing the relationship between macro-faunal burrowing activity and mudflat geomorphology from UAV-based Structure-from-Motion photogrammetry","2020","Remote Sensing of Environment","241","","111717","","","","19","10.1016/j.rse.2020.111717","https://www.scopus.com/inward/record.uri?eid=2-s2.0-85079899077&doi=10.1016%2fj.rse.2020.111717&partnerID=40&md5=9c57f1bb3b54c021237cd79c859175fc","Article","Final","All Open Access; Bronze Open Access; Green Open Access","Scopus","2-s2.0-85079899077"
"Kim Y.; Choi J.-S.; Lee J.; Kim M.","Kim, Yongwoo (57202143770); Choi, Jae-Seok (56584970800); Lee, Jaehyup (57215427721); Kim, Munchurl (8956957700)","57202143770; 56584970800; 57215427721; 8956957700","A CNN-Based Multi-scale Super-Resolution Architecture on FPGA for 4K/8K UHD Applications","2020","Lecture Notes in Computer Science (including subseries Lecture Notes in Artificial Intelligence and Lecture Notes in Bioinformatics)","11962 LNCS","","","739","744","5","3","10.1007/978-3-030-37734-2_63","https://www.scopus.com/inward/record.uri?eid=2-s2.0-85080898277&doi=10.1007%2f978-3-030-37734-2_63&partnerID=40&md5=6a8e0de518dc60edff7cbb321f287929","Conference paper","Final","","Scopus","2-s2.0-85080898277"
"Trebing K.; Mehrkanoon S.","Trebing, Kevin (57218574104); Mehrkanoon, Siamak (35100753600)","57218574104; 35100753600","Wind speed prediction using multidimensional convolutional neural networks","2020","2020 IEEE Symposium Series on Computational Intelligence, SSCI 2020","","","9308323","713","720","7","22","10.1109/SSCI47803.2020.9308323","https://www.scopus.com/inward/record.uri?eid=2-s2.0-85099684109&doi=10.1109%2fSSCI47803.2020.9308323&partnerID=40&md5=3451a63da979b953f1e5f24ab87768d9","Conference paper","Final","All Open Access; Green Open Access","Scopus","2-s2.0-85099684109"
"Choi J.-H.; Kim J.-H.; Cheon M.; Lee J.-S.","Choi, Jun-Ho (55722482400); Kim, Jun-Hyuk (57191686104); Cheon, Manri (55938054900); Lee, Jong-Seok (36062379400)","55722482400; 57191686104; 55938054900; 36062379400","Deep learning-based image super-resolution considering quantitative and perceptual quality","2020","Neurocomputing","398","","","347","359","12","16","10.1016/j.neucom.2019.06.103","https://www.scopus.com/inward/record.uri?eid=2-s2.0-85074505918&doi=10.1016%2fj.neucom.2019.06.103&partnerID=40&md5=2f949d705f1d64aa02bafb2a61f64e97","Article","Final","All Open Access; Green Open Access","Scopus","2-s2.0-85074505918"
"Michelini P.N.; Lu Y.; Jiang X.","Michelini, Pablo Navarrete (57194194558); Lu, Yunhua (57215780166); Jiang, Xingqun (57215776453)","57194194558; 57215780166; 57215776453","Edge-SR: Super-Resolution for the Masses","2022","Proceedings - 2022 IEEE/CVF Winter Conference on Applications of Computer Vision, WACV 2022","","","","4019","4028","9","0","10.1109/WACV51458.2022.00407","https://www.scopus.com/inward/record.uri?eid=2-s2.0-85126112049&doi=10.1109%2fWACV51458.2022.00407&partnerID=40&md5=8325807f69dc01104a7051662fa58cfc","Conference paper","Final","All Open Access; Green Open Access","Scopus","2-s2.0-85126112049"
"He L.; Chen W.; Leblanc S.G.; Lovitt J.; Arsenault A.; Schmelzer I.; Fraser R.H.; Latifovic R.; Sun L.; Prévost C.; White H.P.; Pouliot D.","He, Liming (37115581900); Chen, Wenjun (55597863700); Leblanc, Sylvain G. (57851758800); Lovitt, Julie (57194797446); Arsenault, André (57197249689); Schmelzer, Isabelle (8610566000); Fraser, Robert H. (7402280263); Latifovic, Rasim (6603031730); Sun, Lixin (55492932700); Prévost, Christian (7004231891); White, H. Peter (57226667356); Pouliot, Darren (8212745300)","37115581900; 55597863700; 57851758800; 57194797446; 57197249689; 8610566000; 7402280263; 6603031730; 55492932700; 7004231891; 57226667356; 8212745300","Integration of multi-scale remote sensing data for reindeer lichen fractional cover mapping in Eastern Canada","2021","Remote Sensing of Environment","267","","112731","","","","14","10.1016/j.rse.2021.112731","https://www.scopus.com/inward/record.uri?eid=2-s2.0-85115785950&doi=10.1016%2fj.rse.2021.112731&partnerID=40&md5=30dd53f46f4fac472e4fd626e41579eb","Article","Final","","Scopus","2-s2.0-85115785950"
"Deepak S.; Patra D.; Moorthi S.M.","Deepak, Shashikant (57216807543); Patra, DIpti (23985620900); Moorthi, S. Manthira (54395659100)","57216807543; 23985620900; 54395659100","Single image super-resolution reconstruction of remotely sensed images using MRF-2D phase congruency model","2021","Journal of Applied Remote Sensing","15","4","046507","","","","0","10.1117/1.JRS.15.046507","https://www.scopus.com/inward/record.uri?eid=2-s2.0-85122650203&doi=10.1117%2f1.JRS.15.046507&partnerID=40&md5=a2e37fe8c09e66de86febcdf17114cbd","Article","Final","","Scopus","2-s2.0-85122650203"
"Deng X.; Wang H.; Xu M.; Guo Y.; Song Y.; Yang L.","Deng, Xin (56071493400); Wang, Hao (57194340789); Xu, Mai (55703599800); Guo, Yichen (57222612600); Song, Yuhang (57194406036); Yang, Li (57195075538)","56071493400; 57194340789; 55703599800; 57222612600; 57194406036; 57195075538","LAU-Net: Latitude Adaptive Upscaling Network for Omnidirectional Image Super-resolution","2021","Proceedings of the IEEE Computer Society Conference on Computer Vision and Pattern Recognition","","","","9185","9194","9","15","10.1109/CVPR46437.2021.00907","https://www.scopus.com/inward/record.uri?eid=2-s2.0-85121762963&doi=10.1109%2fCVPR46437.2021.00907&partnerID=40&md5=73328c86bc1aca7f0ea8cc1dfa27e4b1","Conference paper","Final","","Scopus","2-s2.0-85121762963"
"Feldens P.","Feldens, Peter (26324896900)","26324896900","Super resolution by deep learning improves boulder detection in side scan sonar backscatter mosaics","2020","Remote Sensing","12","14","2284","","","","5","10.3390/rs12142284","https://www.scopus.com/inward/record.uri?eid=2-s2.0-85088627522&doi=10.3390%2frs12142284&partnerID=40&md5=98d6e75cbeb1af8403c099bc05377233","Article","Final","All Open Access; Gold Open Access; Green Open Access","Scopus","2-s2.0-85088627522"
"He X.; Santoso R.; Hoteit H.","He, Xupeng (57214912219); Santoso, Ryan (56707499500); Hoteit, Hussein (12764363500)","57214912219; 56707499500; 12764363500","Application of machine-learning to construct equivalent continuum models from high-resolution discrete-fracture models","2020","International Petroleum Technology Conference 2020, IPTC 2020","","","","","","","37","10.2523/iptc-20040-ms","https://www.scopus.com/inward/record.uri?eid=2-s2.0-85085778284&doi=10.2523%2fiptc-20040-ms&partnerID=40&md5=b322c3a0853fa43af9780b709fa7f012","Conference paper","Final","","Scopus","2-s2.0-85085778284"
